{
  "$schema": "../../schemas/app.schema.json",
  "name": "Claw4HR — Passive Talent Intelligence",
  "description": "AI-powered recruiter dashboard: describe a role via chat, and the agent scores indexed profiles using HrFlow AI, displays animated matching scores, clickable skills, SWOT analysis, and real-time pipeline feed.",
  "credentials": {
    "source_keys": [],
    "board_keys": [],
    "algorithm_key": ""
  },
  "settings": {
    "team_name": "Claw4HR",
    "theme_color": "#5B5BE1",
    "custom_filters": [],
    "filters": []
  }
}
