{
  "$schema": "../../schemas/app.schema.json",
  "name": "FirstRound",
  "description": "An AI-powered HR app that helps recruiters quickly identify top candidates by analyzing the result of their Ai powered interview",
  "credentials": {
    "source_keys": [],
    "board_keys": [],
    "algorithm_key": ""
  },
  "settings": {
    "team_name": "Rubber Sheep",
    "theme_color": "#5B5BE1",
    "custom_filters": [],
    "filters": []
  }
}
