{
  "$schema": "../../schemas/app.schema.json",
  "name": "expApp",
  "description": "A short description of what your app does (10-300 characters).",
  "credentials": {
    "source_keys": [],
    "board_keys": [],
    "algorithm_key": ""
  },
  "settings": {
    "team_name": "stark",
    "theme_color": "#5B5BE1",
    "custom_filters": [],
    "filters": []
  }
}
