{
  "$schema": "../schemas/app.schema.json",
  "name": "Scout Flow",
  "description": "A sourcing and candidate ranking app that combines scraped candidates and existing HrFlow sources to build a shortlist for a job.",
  "credentials": {
    "source_keys": [],
    "board_keys": [],
    "algorithm_key": ""
  },
  "settings": {
    "team_name": "Loulou Nassih",
    "theme_color": "#5B5BE1",
    "custom_filters": [],
    "filters": []
  }
}