{
  "$schema": "../../schemas/app.schema.json",
  "name": "CV Killer",
  "description": "AI recruitment tool",
  "credentials": {
    "source_keys": ["source_key"],
    "board_keys": ["board_key"],
    "algorithm_key": "algo_key"
  },
  "settings": {
    "team_name": "APX",
    "theme_color": "#5B5BE1",
    "custom_filters": [],
    "filters": []
  }
}
