{
  "$schema": "../../schemas/app.schema.json",
  "name": "Recruitly",
  "description": "AI recruitment assistant that turns a CV, test scores, and interview notes into a structured hiring recommendation.",
  "credentials": {
    "source_keys": [],
    "board_keys": [],
    "algorithm_key": ""
  },
  "settings": {
    "team_name": "2synthesize",
    "theme_color": "#5B5BE1",
    "custom_filters": [],
    "filters": []
  }
}
